[
  {
    "sourceId": "SRC-GDPT-2018-TIN6",
    "title": "Chương trình giáo dục phổ thông môn Tin học – Lớp 6 (Ban hành kèm theo Thông tư số 32/2018/TT-BGDĐT ngày 26/12/2018)",
    "sourceType": "curriculum_regulation",
    "grade": 6,
    "versionOrSchoolYear": "TT 32/2018/TT-BGDĐT (26/12/2018)",
    "url": "https://vbpl.vn/bogiaoducdaotao/Pages/vbpq-toanvan.aspx?ItemID=146721",
    "driveId": "13o_7GOH_en10qIrlgLTyqrIlJSgCZxma",
    "authority": "Bộ Giáo dục và Đào tạo",
    "priority": 1,
    "licenseNote": "Văn bản quy phạm pháp luật công khai của Bộ GDĐT trên CSDL Quốc gia về VBPL (ItemID=146721)",
    "verifiedAt": "2026-10-24T13:50:00+07:00",
    "accessedAt": "2026-10-24T13:50:00+07:00",
    "internalVerificationStatus": "verified",
    "externalVerificationStatus": "verified",
    "verificationStatus": "both_verified",
    "verificationNote": "Đã kiểm chứng cả bản gốc Drive (13o_7GOH_en10qIrlgLTyqrIlJSgCZxma) và hồ sơ CSDL Quốc gia VBPL (vbpl.vn, ItemID=146721). Thông tư 17/2025/TT-BGDĐT chỉ sửa đổi một số nội dung thuộc các môn Lịch sử và Địa lí, Lịch sử, Địa lí và Giáo dục công dân; không thay đổi YCCĐ môn Tin học lớp 6 đang sử dụng.",
    "scopeUsed": "Toàn bộ 38 Yêu cầu cần đạt (YCCĐ) môn Tin học lớp 6 (Chủ đề A–F) và 5 năng lực tin học cốt lõi (NLa–NLe).",
    "layer": "Layer_A_Teacher_Provided",
    "status": "active",
    "createdAt": "2026-10-24T12:00:00+07:00",
    "updatedAt": "2026-10-24T13:50:00+07:00"
  },
  {
    "sourceId": "SRC-PPCT-VIETHOA-TIN6-2026",
    "title": "Phân phối chương trình (PPCT) môn Tin học 6 – Năm học 2026–2027 – Trường TH, THCS và THPT Việt Hoa",
    "sourceType": "school_ppct",
    "grade": 6,
    "versionOrSchoolYear": "2026-2027",
    "url": "https://drive.google.com/file/d/1Ikqso2NezM1eNOmcAGeq3veuBGTY1wHM/view",
    "driveId": "1Ikqso2NezM1eNOmcAGeq3veuBGTY1wHM",
    "authority": "Trường TH, THCS và THPT Việt Hoa – Tổ Tin học",
    "priority": 2,
    "licenseNote": "Tài liệu kế hoạch dạy học chính thức của Trường TH, THCS và THPT Việt Hoa",
    "verifiedAt": "2026-10-24T13:50:00+07:00",
    "accessedAt": "2026-10-24T13:50:00+07:00",
    "internalVerificationStatus": "verified",
    "externalVerificationStatus": "not_applicable_internal_only",
    "verificationStatus": "internal_source_verified",
    "verificationNote": "Đã kiểm chứng trực tiếp từ file gốc PPCT của trường (Drive ID: 1Ikqso2NezM1eNOmcAGeq3veuBGTY1wHM): 16 bài học nội dung = 29 tiết (Bài 1..7=2t, Bài 8=1t, Bài 9..12=2t, Bài 13=1t, không có Bài 14, Bài 15..16=2t, Bài 17=1t) + 2 tiết ôn tập (CK1, CK2) + 4 tiết kiểm tra (GK1, CK1, GK2, CK2) = 35 tiết.",
    "scopeUsed": "Danh mục 16 bài học nội dung (29 tiết), 2 tiết ôn tập, 4 tiết kiểm tra và lịch 35 tiết thực tế (1–35).",
    "layer": "Layer_A_Teacher_Provided",
    "status": "active",
    "createdAt": "2026-10-24T12:00:00+07:00",
    "updatedAt": "2026-10-24T13:50:00+07:00"
  },
  {
    "sourceId": "SRC-SGK-KNTT-TIN6",
    "title": "Sách giáo khoa Tin học 6 – Bộ Kết nối tri thức với cuộc sống (NXB Giáo dục Việt Nam)",
    "sourceType": "textbook",
    "grade": 6,
    "versionOrSchoolYear": "Tái bản 2025–2026 (ISBN 978-604-0-26018-5)",
    "url": "https://drive.google.com/file/d/1hEqBximpHc2QQVSdEsfcwwPYsaXqeZmj/view",
    "externalReferenceUrl": "https://hanhtrangso.nxbgd.vn/sach-dien-tu/tin-hoc-6-10762",
    "driveId": "1hEqBximpHc2QQVSdEsfcwwPYsaXqeZmj",
    "authority": "Nhà xuất bản Giáo dục Việt Nam (Bộ GDĐT phê duyệt)",
    "priority": 3,
    "licenseNote": "Bản quyền thuộc NXB Giáo dục Việt Nam – kiểm chứng từ bản gốc trên Drive của giáo viên",
    "verifiedAt": "2026-10-24T13:50:00+07:00",
    "accessedAt": "2026-10-24T13:50:00+07:00",
    "internalVerificationStatus": "verified",
    "externalVerificationStatus": "pending",
    "verificationStatus": "internal_source_verified",
    "verificationNote": "Bản gốc SGK trên Drive (1hEqBximpHc2QQVSdEsfcwwPYsaXqeZmj) đã xác minh (internal = verified); cổng Hành trang số (external = pending) do yêu cầu đăng nhập tài khoản.",
    "scopeUsed": "Tên bài học Bài 1–13, Bài 15–17, cấu trúc Bài 3 (Thông tin trong máy tính) và phần mở rộng kiến thức TB.",
    "layer": "Layer_A_Teacher_Provided",
    "status": "active",
    "createdAt": "2026-10-24T12:00:00+07:00",
    "updatedAt": "2026-10-24T13:50:00+07:00"
  },
  {
    "sourceId": "SRC-TT02-2025-NLS",
    "title": "Thông tư số 02/2025/TT-BGDĐT ngày 24/01/2025 của Bộ GDĐT quy định Khung năng lực số cho người học",
    "sourceType": "digital_competency_framework",
    "grade": 6,
    "versionOrSchoolYear": "TT 02/2025/TT-BGDĐT (24/01/2025)",
    "url": "https://vbpl.vn/bogiaoducdaotao/Pages/vbpq-toanvan.aspx?ItemID=175173",
    "driveId": null,
    "authority": "Bộ Giáo dục và Đào tạo",
    "priority": 4,
    "licenseNote": "Văn bản quy phạm pháp luật công khai trên CSDL Quốc gia về VBPL (ItemID=175173)",
    "verifiedAt": "2026-10-24T13:50:00+07:00",
    "accessedAt": "2026-10-24T13:50:00+07:00",
    "internalVerificationStatus": "not_available",
    "externalVerificationStatus": "verified",
    "verificationStatus": "official_external_verified",
    "verificationNote": "Đã xác minh văn bản pháp quy Thông tư 02/2025/TT-BGDĐT (ban hành ngày 24/01/2025) trên CSDL Quốc gia về VBPL (vbpl.vn, ItemID=175173). Chưa có bản PDF/DOC riêng của Thông tư 02 trong Google Drive của trường (driveId = null, internalVerificationStatus = not_available); không dùng Drive ID của Phụ lục III làm driveId của Thông tư 02.",
    "scopeUsed": "Framework nguồn pháp quy cho Khung năng lực số (cung cấp mã khung 1.3.TC1a, 5.2.TC1a, 5.2.TC1b; phần diễn giải áp dụng cụ thể cho Bài 3 nằm ở Phụ lục III lớp 6 SRC-PHULUC3-TIN6-VIETHOA-2026).",
    "layer": "Layer_B_Official_Authoritative",
    "status": "active",
    "createdAt": "2026-10-24T12:00:00+07:00",
    "updatedAt": "2026-10-24T14:25:00+07:00"
  },
  {
    "sourceId": "SRC-PHULUC3-TIN6-VIETHOA-2026",
    "title": "Phụ lục III – Kế hoạch giáo dục của giáo viên môn Tin học lớp 6 (Tích hợp Năng lực số) – Trường TH, THCS và THPT Việt Hoa",
    "sourceType": "school_deployment_appendix",
    "grade": 6,
    "versionOrSchoolYear": "2026-2027",
    "url": "https://drive.google.com/file/d/1eB5ZVwDLISaR57-DM2B9TJ9-JYgobwAC/view",
    "driveId": "1eB5ZVwDLISaR57-DM2B9TJ9-JYgobwAC",
    "authority": "Trường TH, THCS và THPT Việt Hoa – Tổ Tin học",
    "priority": 5,
    "licenseNote": "Hồ sơ chuyên môn nội bộ của trường (Phụ lục III lớp 6)",
    "verifiedAt": "2026-10-24T13:50:00+07:00",
    "accessedAt": "2026-10-24T13:50:00+07:00",
    "internalVerificationStatus": "verified",
    "externalVerificationStatus": "not_applicable_internal_only",
    "verificationStatus": "internal_source_verified",
    "verificationNote": "Đã xác minh từ file gốc Phụ lục III lớp 6 trên Drive (1eB5ZVwDLISaR57-DM2B9TJ9-JYgobwAC).",
    "scopeUsed": "Nguồn gốc chính xác quy định mapping các mã NLS 1.3.TC1a, 5.2.TC1a, 5.2.TC1b vào Bài 3 (G6-L03).",
    "layer": "Layer_A_Teacher_Provided",
    "status": "active",
    "createdAt": "2026-10-24T12:00:00+07:00",
    "updatedAt": "2026-10-24T13:50:00+07:00"
  },
  {
    "sourceId": "SRC-KHBD-TIN6-BAI3-VIETHOA",
    "title": "Kế hoạch bài dạy (KHBD) Tin học 6 – Bài 3: Thông tin trong máy tính – Trường TH, THCS và THPT Việt Hoa",
    "sourceType": "teacher_lesson_plan",
    "grade": 6,
    "versionOrSchoolYear": "2026-2027",
    "url": "https://drive.google.com/file/d/1vMj4YlylG09AqZOuc3G9hNq-L-MFHRtp/view",
    "driveId": "1vMj4YlylG09AqZOuc3G9hNq-L-MFHRtp",
    "authority": "Trường TH, THCS và THPT Việt Hoa – Giáo viên Tin học",
    "priority": 6,
    "licenseNote": "Kế hoạch bài dạy nội bộ của giáo viên (KHBD Bài 3)",
    "verifiedAt": "2026-10-24T13:50:00+07:00",
    "accessedAt": "2026-10-24T13:50:00+07:00",
    "internalVerificationStatus": "verified",
    "externalVerificationStatus": "not_applicable_internal_only",
    "verificationStatus": "internal_source_verified",
    "verificationNote": "Đã xác minh từ file gốc KHBD Tin 6 – Bài 3 trên Drive (1vMj4YlylG09AqZOuc3G9hNq-L-MFHRtp).",
    "scopeUsed": "Tham chiếu bổ sung cho tổ chức hoạt động và tích hợp NLS (1.3.TC1a, 5.2.TC1a, 5.2.TC1b) trong Bài 3.",
    "layer": "Layer_A_Teacher_Provided",
    "status": "active",
    "createdAt": "2026-10-24T12:00:00+07:00",
    "updatedAt": "2026-10-24T13:50:00+07:00"
  }
]
